SIC,Industry_Code,LFS_Description,ONS_Description
342,63.22,Other water transport activities,Other supporting water transport activities
343,63.23,Other air transport activities,Other supporting air transport activities
344,63.301-3,"Travel agenc.,organisers,guides","Activities of travel agencies, organisers and tour guides"
345,63.304,Other tourist assistance,Other tourist assistance activities not elsewhere classified
346,63.40,Other transport agencies,Activities of other transport agencie
347,64.11,National post activities,National post activities
348,64.12,Courier activ. (not natnl. Post),Courier activities other than national post activities
349,64.20,Telecommunications,Telecommunications
350,65.11,Central banking,Central banking
351,65.121,Banks,Banks
352,65.122,Building societies,Building societies
353,65.21,Financial leasing,Financial leasing
354,65.22,Other credit granting,Other credit granting
355,65.231-6,"Unit,inv trusts,hlding co etc","Activities of unit trust, investment trusts and bank holding"
356,65.233,Securities dealing for self,Security dealing on own account
357,66.01,Life insurance,Life insurance
358,66.02,Pension funding,Pension funding
359,66.03,Non-life insurance,Non-life insurance
360,67.11,Financial market administration,Administration of financial markets
361,67.12,"Securities,fund management",Security broking and fund management
362,67.13,Other financial intermed. activ.,Activities auxiliary to financial intermediation not elsewhere
363,67.20,Other insurance activities,Activities auxiliary to insurance and pension funding
364,70.11,"Development,sale of real estate",Development and selling of real estate
365,70.12,"Buying,selling real estate,self",Buying and selling of own real estate
366,70.20,Letting own property,Letting of own property
367,70.31,Real estate agency,Real estate agencies
368,70.32,Management of real estate,Management of real estate on a fee or contract basis
369,71.10,Car rental,Renting of automobiles
370,71.21,Other land transport rental,Renting of other land transport equipment
371,71.22,Water transport eqt rental,Renting of water transport equipment
372,71.23,Air transport eqt rental,Renting of air transport equipment
373,71.31,"Agricultural mach,eqt rental",Renting of agricultural machinery and equipment
374,71.32,"Construction mach,eqt rental",Renting of construction and civil engineering machinery
375,71.33,"Office mach,eqt rental",Renting of office machinery and equipment including
376,71.34,"Other mach,eqt rental",Renting of other machinery and equipment not elsewhere
377,71.40,"Person,hhld eqt rental",Renting of personal and household goods not elsewhere
378,72.10,Computer hardware consultancy,Hardware consultancy
379,72.20,Computer software consultancy,Software consultancy and supply
380,72.30,Data processing,Data processing
381,72.40,Data base activities,Data base activities
382,72.50,"Repair of office,computer eqt","Maintenance and repair of office, accounting and"
383,72.60,Other computer activities,Other computer related activities
384,73.10,"Research,natural sciences,engin.",Research and experimental development on natural
385,73.20,"Res.,social sciences,humanities",Research and experimental development on social
386,74.11,Legal activities,Legal activities
387,74.12,"Accountng,auditng,tax consultancy","Accounting, book-keeping and auditing activities; tax"
388,74.13,"Market,opinion research",Market research and public opinion polling
389,74.14,"Business,management consultancy",Business and management consultancy activities
390,74.15,"Managemnt activities,holding comps",Management activities of holding companies
391,74.20,"Archit.,engineering,etc consultncy",Architectural and engineering activities and related
392,74.30,"Technical testing,analysis",Technical testing and analysis
393,74.40,Advertising,Advertising
394,74.50,"Labour,personnel recruitment",Labour recruitment and provision of personnel
395,74.60,"Investigation,security services",Investigation and security activities
396,74.70,Industrial cleaning,Industrial cleaning
397,74.81,Photographic activities,Photographic activities
398,74.82,Packaging activities,Packaging activities
399,74.83,"Secretarial,translation",Secretarial and translation activities
400,74.84,Other business activities,Other business activities not elsewhere classified
401,75.11,General public service activities,General (overall) public service activities
402,75.12,Reguln Govt agency (not Soc Sec),Regulation of the activities of agencies that provide health
403,75.13,Development of Govt agencies,Regulation of and contribution to more efficient operation
404,75.14,Support of Govt as a whole,Supporting service activities for the government as a whole
405,75.21,Foreign affairs,Foreign affairs
406,75.22,Defence,Defence activities
407,75.23,Justice and judicial activities,Justice and judicial activities
408,75.24,"Public security,law and order etc","Public security, law and order activities"
409,75.25,Fire service,Fire service activities
410,75.30,Compulsory Social Security activ.,Compulsory social security activities
411,80.10,"Primary educ,state,maintained",Primary education
412,80.10,"Primary educ,priv.,non-maintained",Primary education
413,80.21,"Gen. 2ndry educ,state,maintained",General secondary education
414,80.21,"Gen. 2ndry educ,private,non-main.",General secondary education
415,80.22,"Tech,vocational 2nd-ary educ","Technical, vocational secondary education, special"
416,,"Special educ,state,maintained","Special Education, State, Maintained"
417,,"Special educ,private non-maintained","Special Education, Private, Non-maintained"
418,80.301,Sub-degree level educ,Sub-degree level higher education
419,80.302+3,First & post degree level educ.,First-degree and post-graduate levels higher education
420,80.41,Driving school activities,Driving school activities
421,80.42,"Adult,other educ",Adult and other education not elsewhere classifie
422,85.11,Hospital activities,Hospital activities
423,85.12,Medical practice activities,Medical practice activities
424,85.13,Dental practice activities,Dental practice activities
425,85.14,Other human health activities,Other human health activities
426,85.20,Veterinary activities,Veterinary activities
427,85.31,Social work with accom,Social work activities with accommodation
428,85.32,Social work without accom,Social work activities without accommodatio
429,90.00,"Sewage,refuse disposal etc","Sewage and refuse disposal, sanitation and similar"
430,91.11,"Business,employers organisations",Activities of business and employers organisations
431,91.12,Professional organisations,Activities of professional organisations
432,91.20,Trade unions,Activities of trade unions
433,91.31,Religious organisations,Activities of religious organisations
434,91.32,Political organisations,Activities of political organisations
435,91.33,Other membership organisations,Activities of other membership organisations not elsewhere
436,92.11,"Motion picture,video production",Motion picture and video production
437,92.12,"Motion picture,video distribution",Motion picture and video production
438,92.13,Motion picture projection,Motion picture projection
439,92.20,"Radio,TV activities",Radio and television activities
440,92.31,"Artistic,literary creation etc",Artistic and literary creation and interpretation
441,92.32,Arts facilities,Operation of arts facilities
442,92.33,"Fair,amusement park activities",Fair and amusement park activities
443,92.34,Other entertainment activities,Other entertainment activities not elsewhere classified
444,92.40,News agency activities,News agency activities
445,92.51,"Library,archive activities",Library and archives activities
446,92.52,Museum activities,Museum activities and preservation of historical sites and
447,92.53,"Botanical,zoological gardens etc",Botanical and zoological gardens and nature reserves
448,92.61,"Operation of sports arenas,stadia",Operation of sports arenas and stadiums
449,92.62,Other sporting activities,Other sporting activities
450,92.71,"Gambling,betting activities",Gambling and betting activities
451,92.72,Other recreational activities,Other recreational activities not elsewhere classified
452,93.01,"Washing,dry cleaning textiles,furs",Washing and dry cleaning of textile and fur products
453,93.02,"Hairdressing,oth beauty treatment",Hairdressing and other beauty treatment
454,93.03,Funeral etc,Funeral and related activities
455,93.04,Physical well-being activities,Physical well-being activities
456,93.05,Other service activities,Other service activities not elsewhere classified
457,95.00,Priv. hhlds with emplyed persons,Private households with employed persons
458,99.00,Extra-territorial organisations,Extra-territorial organisations and bodies
459,,"Inadequate description,No reply","Inadequate description,No reply"
460,,"No Answer/NA","No Answer/NA"
461,,Workplace outside UK,Workplace outside UK
462,,Did Not Answer,Did Not Answer
